{
  "globalSettings": {
    "enableAccessControl": false,
    "maxAggregateSize": 10000,
    "maxResultHits": 10000,
    "maxAnalyzedOffset": 1000,
    "aggregations": [
      {
        "name": "serviceType",
        "type": "terms",
        "field": "serviceType"
      },
      {
        "name": "service.displayName.keyword",
        "type": "terms",
        "field": "service.displayName.keyword"
      },
      {
        "name": "entityType",
        "type": "terms",
        "field": "entityType"
      },
      {
        "name": "entityType.keyword",
        "type": "terms",
        "field": "entityType.keyword"
      },
      {
        "name": "tier.tagFQN",
        "type": "terms",
        "field": "tier.tagFQN"
      },
      {
        "name": "ownerDisplayName",
        "type": "terms",
        "field": "ownerDisplayName"
      },
      {
        "name": "domains.displayName.keyword",
        "type": "terms",
        "field": "domains.displayName.keyword"
      },
      {
        "name": "tags.tagFQN",
        "type": "terms",
        "field": "tags.tagFQN"
      },
      {
        "name": "classificationTags",
        "type": "terms",
        "field": "classificationTags"
      },
      {
        "name": "glossaryTags",
        "type": "terms",
        "field": "glossaryTags"
      },
      {
        "name": "certification.tagLabel.tagFQN",
        "type": "terms",
        "field": "certification.tagLabel.tagFQN"
      },
      {
        "name": "database.name.keyword",
        "type": "terms",
        "field": "database.name.keyword"
      },
      {
        "name": "databaseSchema.name.keyword",
        "type": "terms",
        "field": "databaseSchema.name.keyword"
      },
      {
        "name": "database.displayName",
        "type": "terms",
        "field": "database.displayName"
      },
      {
        "name": "databaseSchema.displayName",
        "type": "terms",
        "field": "databaseSchema.displayName"
      }
    ],
    "highlightFields": [
      "name",
      "displayName",
      "description"
    ],
    "termBoosts": [
      {
        "field": "tier.tagFQN",
        "value": "Tier.Tier1",
        "boost": 50
      },
      {
        "field": "tier.tagFQN",
        "value": "Tier.Tier2",
        "boost": 30
      },
      {
        "field": "tier.tagFQN",
        "value": "Tier.Tier3",
        "boost": 10
      }
    ],
    "fieldValueBoosts": [
      {
        "field": "usageSummary.weeklyStats.count",
        "factor": 4.0,
        "modifier": "sqrt",
        "missing": 1
      },
      {
        "field": "totalVotes",
        "factor": 2.0,
        "modifier": "sqrt",
        "missing": 0
      },
      {
        "field": "usageSummary.weeklyStats.percentileRank",
        "factor": 1.0,
        "modifier": "none",
        "missing": 0
      }
    ]
  },
  "assetTypeConfigurations": [
    {
      "assetType": "database",
      "searchFields": [
        {
          "field": "displayName.keyword",
          "boost": 20.0,
          "matchType": "exact"
        },
        {
          "field": "name",
          "boost": 10.0,
          "matchType": "phrase"
        },
        {
          "field": "name.ngram",
          "boost": 1.0,
          "matchType": "fuzzy"
        },
        {
          "field": "name.compound",
          "boost": 8.0,
          "matchType": "standard"
        },
        {
          "field": "displayName",
          "boost": 10.0,
          "matchType": "phrase"
        },
        {
          "field": "displayName.ngram",
          "boost": 1.0,
          "matchType": "fuzzy"
        },
        {
          "field": "description",
          "boost": 2.0,
          "matchType": "standard"
        },
        {
          "field": "displayName.compound",
          "boost": 8.0,
          "matchType": "standard"
        },
        {
          "field": "fullyQualifiedName",
          "boost": 5.0,
          "matchType": "standard"
        },
        {
          "field": "fqnParts",
          "boost": 5.0,
          "matchType": "standard"
        }
      ],
      "highlightFields": [
        "name",
        "description",
        "displayName"
      ],
      "aggregations": [],
      "scoreMode": "sum",
      "boostMode": "sum",
      "matchTypeBoostMultipliers": {
        "exactMatchMultiplier": 2.0,
        "phraseMatchMultiplier": 1.5,
        "fuzzyMatchMultiplier": 1.0
      }
    },
    {
      "assetType": "databaseSchema",
      "searchFields": [
        {
          "field": "displayName.keyword",
          "boost": 20.0,
          "matchType": "exact"
        },
        {
          "field": "name.keyword",
          "boost": 20.0,
          "matchType": "exact"
        },
        {
          "field": "name",
          "boost": 10.0,
          "matchType": "phrase"
        },
        {
          "field": "name.ngram",
          "boost": 1.0,
          "matchType": "fuzzy"
        },
        {
          "field": "name.compound",
          "boost": 8.0,
          "matchType": "standard"
        },
        {
          "field": "displayName",
          "boost": 10.0,
          "matchType": "phrase"
        },
        {
          "field": "displayName.ngram",
          "boost": 1.0,
          "matchType": "fuzzy"
        },
        {
          "field": "description",
          "boost": 2.0,
          "matchType": "standard"
        },
        {
          "field": "displayName.compound",
          "boost": 8.0,
          "matchType": "standard"
        },
        {
          "field": "fullyQualifiedName",
          "boost": 5.0,
          "matchType": "standard"
        },
        {
          "field": "fqnParts",
          "boost": 5.0,
          "matchType": "standard"
        }
      ],
      "matchTypeBoostMultipliers": {
        "exactMatchMultiplier": 2.0,
        "phraseMatchMultiplier": 1.5,
        "fuzzyMatchMultiplier": 1.0
      },
      "highlightFields": [
        "name",
        "description",
        "displayName"
      ],
      "aggregations": [],
      "scoreMode": "sum",
      "boostMode": "sum"
    },
    {
      "assetType": "table",
      "searchFields": [
        {
          "field": "displayName.keyword",
          "boost": 20.0,
          "matchType": "exact"
        },
        {
          "field": "name",
          "boost": 10.0,
          "matchType": "phrase"
        },
        {
          "field": "name.ngram",
          "boost": 1.0,
          "matchType": "fuzzy"
        },
        {
          "field": "name.compound",
          "boost": 8.0,
          "matchType": "standard"
        },
        {
          "field": "displayName",
          "boost": 10.0,
          "matchType": "phrase"
        },
        {
          "field": "displayName.ngram",
          "boost": 1.0,
          "matchType": "fuzzy"
        },
        {
          "field": "description",
          "boost": 2.0,
          "matchType": "standard"
        },
        {
          "field": "displayName.compound",
          "boost": 8.0,
          "matchType": "standard"
        },
        {
          "field": "fullyQualifiedName",
          "boost": 5.0,
          "matchType": "standard"
        },
        {
          "field": "fqnParts",
          "boost": 5.0,
          "matchType": "standard"
        },
        {
          "field": "columns.name.keyword",
          "boost": 2.0,
          "matchType": "exact"
        },
        {
          "field": "columns.displayName.keyword",
          "boost": 2.0,
          "matchType": "exact"
        },
        {
          "field": "columns.children.name.keyword",
          "boost": 1.0,
          "matchType": "exact"
        },
        {
          "field": "columnNamesFuzzy",
          "boost": 1.5,
          "matchType": "standard"
        }
      ],
      "aggregations": [
        {
          "name": "database.displayName.keyword",
          "type": "terms",
          "field": "database.displayName.keyword"
        },
        {
          "name": "databaseSchema.displayName.keyword",
          "type": "terms",
          "field": "databaseSchema.displayName.keyword"
        }
      ],
      "scoreMode": "sum",
      "boostMode": "sum",
      "highlightFields": [
        "name",
        "description",
        "displayName"
      ],
      "fieldValueBoosts": [
        {
          "field": "usageSummary.monthlyStats.count",
          "factor": 3.0,
          "modifier": "log1p",
          "missing": 0
        },
        {
          "field": "usageSummary.monthlyStats.percentileRank",
          "factor": 1.0,
          "modifier": "none",
          "missing": 0
        }
      ],
      "matchTypeBoostMultipliers": {
        "exactMatchMultiplier": 2.0,
        "phraseMatchMultiplier": 1.5,
        "fuzzyMatchMultiplier": 1.0
      }
    },
    {
      "assetType": "tableColumn",
      "searchFields": [
        {
          "field": "displayName.keyword",
          "boost": 20.0,
          "matchType": "exact"
        },
        {
          "field": "name",
          "boost": 10.0,
          "matchType": "phrase"
        },
        {
          "field": "name.ngram",
          "boost": 1.0,
          "matchType": "fuzzy"
        },
        {
          "field": "name.compound",
          "boost": 8.0,
          "matchType": "standard"
        },
        {
          "field": "displayName",
          "boost": 7.0,
          "matchType": "phrase"
        },
        {
          "field": "displayName.ngram",
          "boost": 1.0,
          "matchType": "fuzzy"
        },
        {
          "field": "displayName.compound",
          "boost": 6.0,
          "matchType": "standard"
        },
        {
          "field": "description",
          "boost": 2.0,
          "matchType": "standard"
        },
        {
          "field": "dataType",
          "boost": 3.0,
          "matchType": "exact"
        },
        {
          "field": "table.name",
          "boost": 5.0,
          "matchType": "phrase"
        },
        {